{
  "schema_version": "dime-dataset-manifest-v3",
  "dataset_version": "dime-sft-foundation-v1-public-450",
  "visibility": "public",
  "publication_classification": "approved-public",
  "provenance_source_class": "mixed",
  "source_owner": "AI Sports Betting Models platform owner",
  "rights_basis": "Platform-owner-authorized publication of teacher-generated records derived from first-party repository artifacts and synthetic fixtures.",
  "license_or_usage_restrictions": "Public repository use without warranty. Downstream users must independently verify any sports-data or provider obligations before redistribution.",
  "synthetic_status": "not-synthetic",
  "contains_user_data": false,
  "contains_provider_derived_data": false,
  "approval_status": "approved",
  "approved": true,
  "approved_at_utc": "2026-07-31T11:33:43Z",
  "reviewer_ids": ["platform-owner-publication-authorization-2026-07-31"],
  "train_record_count": 405,
  "validation_record_count": 45,
  "train_sha256": "341b4e8d07726593be0963934b7ab250cfb0a8475e90fd5b367887d5aedd6a79",
  "validation_sha256": "2ede69086eabe879046e022184213d64a9a50e2f469ae7031b0e7b94f4716d9c",
  "curriculum_config_sha256": "119d39ab7a665d8ea21703ad7262d1d8077a051962660bc1f430505a2f892d81",
  "tool_catalog_sha256": "56f3c39fd730f9d923efcf837433825d76de4c4acb51d668095d1eb68db4cca5",
  "chat_template_sha256": "2407ed345ce3013e1e1279d46ea7e4e6e78a9a0696ac226a2f24f697b9504087",
  "rights_reviewed": true,
  "consent_reviewed": true,
  "privacy_reviewed": true,
  "partition_audit_passed": true,
  "future_data_audit_passed": true,
  "semantic_dedup_audit_passed": true,
  "evaluation_contamination_audit_passed": true,
  "direct_identifier_scan_version": "dime-publication-sensitive-material-scan-v1",
  "deletion_policy_id": "no-user-data-public-release-v1",
  "limitations_notes": "The 450 records are teacher-generated and include synthetic tool/provider identifiers, not provider-supplied production data. Publication does not authorize model training, provider execution, deployment, tracing, or route activation."
}
