{
  "schema_version": "dime-dataset-manifest-v3",
  "dataset_version": "REPLACE_ME",
  "visibility": "public",
  "publication_classification": "approved-public",
  "provenance_source_class": "synthetic",
  "source_owner": "REPLACE_ME",
  "rights_basis": "REPLACE_ME",
  "license_or_usage_restrictions": "REPLACE_ME",
  "synthetic_status": "fully-synthetic",
  "contains_user_data": false,
  "contains_provider_derived_data": false,
  "approval_status": "draft",
  "approved": false,
  "approved_at_utc": null,
  "reviewer_ids": [],
  "train_record_count": null,
  "validation_record_count": null,
  "train_sha256": null,
  "validation_sha256": null,
  "curriculum_config_sha256": null,
  "tool_catalog_sha256": null,
  "chat_template_sha256": null,
  "rights_reviewed": false,
  "consent_reviewed": false,
  "privacy_reviewed": false,
  "partition_audit_passed": false,
  "future_data_audit_passed": false,
  "semantic_dedup_audit_passed": false,
  "evaluation_contamination_audit_passed": false,
  "direct_identifier_scan_version": null,
  "deletion_policy_id": null,
  "limitations_notes": "Template only. Copy to dataset_manifest_APPROVED.json only after public-publication, privacy, rights, consent, partition, future-data, semantic-deduplication, and evaluation-contamination review."
}
